{
  "experimental_only": true,
  "features": {
    "variance": 0.31
  },
  "frame_format": "adr018-binary",
  "limitations": [
    "jsonl-rvf loader gap documented upstream",
    "fallback visible, never silent null",
    "no victim detection output"
  ],
  "model_version": {
    "commit": "90667d0f1d9f4dc129d999c7998d4036cac2e1b8",
    "format": "jsonl-rvf",
    "hash": "6666666666666666666666666666666666666666666666666666666666666666"
  },
  "node_id": "ruview-node-02",
  "observation_id": "34000000-0000-4000-8000-000000000002",
  "outputs_are_victim_detected": false,
  "quality": 0.4,
  "record_type": "ruview_observation",
  "schema_version": "1.0.0",
  "source_commit": "90667d0f1d9f4dc129d999c7998d4036cac2e1b8",
  "source_mode": "udp-adr018",
  "stream_metrics": {
    "effective_rate_hz": 40,
    "jitter_seconds": 0.02,
    "loss_ratio": 0.1
  },
  "timestamp": "2026-07-17T17:01:00.000000Z",
  "unknown_class_required": true,
  "warnings": [
    "jsonl-rvf gap: invalid magic fallback must stay visible"
  ]
}
